{
  "schema": "capability-descriptor@1.1",
  "worker": "worker:account-a/standard",
  "provider": "provider-a",
  "family": "provider-a",
  "tier": "standard",
  "quotaClass": "subscription-chat",
  "locality": "remote",
  "capabilities": [
    { "capability": "reason", "evidence": { "kind": "conformance", "at": "2026-10-16T00:00:00Z" } },
    { "capability": "web-search", "evidence": { "kind": "probe", "at": "2026-10-16T00:00:00Z" } }
  ],
  "state": "ready",
  "observedAt": "2026-10-16T00:00:00Z"
}
