{
  "schema": "capability-descriptor@1.3",
  "worker": "worker:account-b/standard",
  "provider": "provider-a",
  "family": "provider-a",
  "maxInputChars": 30000,
  "load": {
    "running": 1,
    "queued": 0,
    "pending": 1,
    "slots": 2
  },
  "tier": "standard",
  "quotaClass": "subscription-chat",
  "locality": "remote",
  "capabilities": [
    {
      "capability": "reason",
      "evidence": {
        "kind": "conformance",
        "at": "2026-10-16T00:00:00Z"
      }
    },
    {
      "capability": "web-search",
      "evidence": {
        "kind": "probe",
        "at": "2026-10-16T00:00:00Z"
      }
    }
  ],
  "state": "ready",
  "observedAt": "2026-10-16T00:00:00Z"
}
